{
  "contract_version": "scoped-consumer-eligibility/0.2.0-draft",
  "decision_id": "example-eligibility-2099-01-002-v1",
  "decision_version": 1,
  "supersedes_decision_id": null,
  "run_id": "2099-01-r99",
  "activity_id": "example-activity-2099-01-002",
  "consumer_id": "calendar-renderer",
  "decision": "eligible",
  "allowed_fields": [
    "activity_id",
    "activity_title",
    "dates",
    "time"
  ],
  "prohibited_uses": [
    "newsletter-publication",
    "infer-missing-values"
  ],
  "eligibility_subject_sha256": "31b798fbd9c6de6819f886fcfa2ffa33fa926a530028200ca2c95bb50b8def37",
  "authority_purpose": "calendar-eligibility",
  "authority_reference": {
    "registry_id": "example-calendar-registry",
    "authority_id": "example-eligibility-authority-002"
  },
  "authority_artifact_sha256": "bbbbbbbbbbbbbbbbbbbbbbbbbbbbbbbbbbbbbbbbbbbbbbbbbbbbbbbbbbbbbbbb",
  "decided_at": "2099-01-02T09:00:00Z"
}
